{
  "schemaVersion": 1,
  "slug": "applied-ai-engineer",
  "title": "Applied AI Engineer",
  "summary": "A product-oriented engineer who turns uncertain model capability into useful, measurable, reliable, and governable behavior for defined users and tasks.",
  "status": "draft",
  "boundary": {
    "includes": [
      "Define task-specific product behavior and maintain the evidence loop from hypothesis through operation and controlled change.",
      "Build and evaluate the combined data, model, software, interface, control, and operating system around learned behavior.",
      "Prepare technical evidence, expose limitations, and route product, domain, legal, safety, privacy, security, and formal risk decisions to named authorities."
    ],
    "excludes": [
      "Create frontier model capability as a research scientist or own the full model and data platform lifecycle by default.",
      "Own customer engagement delivery, commercial commitments, product-roadmap priority, or every system dependency by default.",
      "Act as legal counsel, domain authority, independent auditor, or unilateral safety, privacy, security, and business risk acceptor."
    ]
  },
  "competencies": [
    {"id":"AAE-C01","title":"Task, value, and AI decision","description":"Define a consequential user task and test whether an AI mechanism is justified.","objectives":[{"id":"AAE-K01","statement":"Define the user task and consequence, test the value hypothesis, and choose AI only when evidence supports it."}]},
    {"id":"AAE-C02","title":"Behavior contracts and boundaries","description":"Specify observable behavior, uncertainty, system limits, and escalation paths.","objectives":[{"id":"AAE-K02","statement":"Specify observable behavior, uncertainty, non-goals, escalation, degradation, and system and authority boundaries."}]},
    {"id":"AAE-C03","title":"Model and mechanism selection","description":"Compare learned and deterministic mechanisms against task evidence and constraints.","objectives":[{"id":"AAE-K03","statement":"Compare deterministic, search, predictive, generative, agentic, adapted, and hybrid mechanisms under real constraints."}]},
    {"id":"AAE-C04","title":"Data, context, retrieval, and grounding","description":"Construct authorized, representative task evidence and runtime context paths.","objectives":[{"id":"AAE-K04","statement":"Build authorized, representative task inputs and context paths with provenance, relevance, leakage, and limitation controls."}]},
    {"id":"AAE-C05","title":"Production application and integration","description":"Implement inspectable software and controls around uncertain learned behavior.","objectives":[{"id":"AAE-K05","statement":"Implement services, schemas, interfaces, orchestration, tools, validation, permissions, and user feedback around learned behavior."}]},
    {"id":"AAE-C06","title":"Evaluation and experimentation","description":"Build representative evidence and experiments tied to user consequence.","objectives":[{"id":"AAE-K06","statement":"Create representative evidence, error taxonomies, segmented judgments, calibrated review, experiments, and release dispositions."}]},
    {"id":"AAE-C07","title":"Operational quality and observability","description":"Engineer and diagnose the quality, reliability, latency, capacity, and cost envelope.","objectives":[{"id":"AAE-K07","statement":"Engineer reliability, latency, throughput, capacity, cost, privacy-safe signals, diagnosis, fallback, and recovery."}]},
    {"id":"AAE-C08","title":"Responsible controls and authority","description":"Implement proportionate controls while preserving named decision authority.","objectives":[{"id":"AAE-K08","statement":"Implement and test proportionate privacy, security, safety, abuse, governance, and human-authority controls without self-authorizing risk."}]},
    {"id":"AAE-C09","title":"Release, feedback, and incident learning","description":"Bound exposure and turn production feedback and incidents into verified improvement.","objectives":[{"id":"AAE-K09","statement":"Bound rollout, monitor use and behavior, respond to incidents, and convert production evidence into controlled improvement."}]},
    {"id":"AAE-C10","title":"Change, portability, and evidence-earned reuse","description":"Preserve product behavior through change and standardize only after repeated evidence.","objectives":[{"id":"AAE-K10","statement":"Survive model, provider, and data change and build reusable mechanisms only when repeated evidence justifies them."}]},
    {"id":"AAE-C11","title":"Advanced technical leadership","description":"Set evidence standards and lead cross-system decisions without absorbing adjacent authority.","objectives":[{"id":"AAE-K11","statement":"Set evidence standards, resolve cross-system tradeoffs, communicate limitations, mentor teams, and preserve adjacent-role authority."}]}
  ]
}
