{
  "schemaVersion": 1,
  "slug": "agentic-ai-engineer",
  "title": "Agentic AI Engineer",
  "summary": "Designs, evaluates, and operates bounded model-directed systems that act through tools while preserving state, authority, evidence, recovery, and named professional boundaries.",
  "status": "draft",
  "boundary": {
    "includes": [
      "Agent suitability, goal and action contracts, harnesses, tools, state, handoffs, durable effects, evaluation, controls, operations, and change evidence",
      "Application-level identity, delegated authority, approval, recovery, trace, release, and interoperability semantics"
    ],
    "excludes": [
      "Broad AI product selection, model training, customer engagement, shared platform ownership, and enterprise architecture",
      "Formal security, safety, privacy, legal, domain, financial, clinical, or physical-world risk authorization"
    ]
  },
  "competencies": [
    {"id":"AGE-K01","title":"Agent suitability and action contracts","description":"Selects justified autonomy and contracts goals, actions, consequences, limits, and authority.","objectives":[{"id":"AGE-K01-01","statement":"Choose the least complex adequate execution model and specify observable completion, effects, authority, budgets, stop, and escalation."}]},
    {"id":"AGE-K02","title":"Loop, harness, and run-state engineering","description":"Builds explicit inspectable loops with deterministic enforcement around model choice.","objectives":[{"id":"AGE-K02-01","statement":"Implement replayable run transitions, cancellation, completion checks, and deterministic enforcement."}]},
    {"id":"AGE-K03","title":"Tools and capability interfaces","description":"Designs narrow typed capabilities with effect, error, idempotency, and test semantics.","objectives":[{"id":"AGE-K03-01","statement":"Expose bounded capabilities and handle validation, ambiguity, duplicate effects, and compensation limits."}]},
    {"id":"AGE-K04","title":"State, context, artifacts, and memory","description":"Separates workflow truth, model context, scratch state, durable artifacts, and derived memory.","objectives":[{"id":"AGE-K04-01","statement":"Apply provenance, freshness, permission, isolation, retention, and deletion to every state class."}]},
    {"id":"AGE-K05","title":"Identity, authorization, delegation, and consent","description":"Binds principals, agents, tasks, scopes, approvals, expiry, revocation, and audit evidence.","objectives":[{"id":"AGE-K05-01","statement":"Enforce least privilege and bind exact effects to valid delegated authority without credential leakage."}]},
    {"id":"AGE-K06","title":"Orchestration, handoffs, and multi-agent coordination","description":"Adds routing or multiple agents only when controlled evidence justifies coordination cost.","objectives":[{"id":"AGE-K06-01","statement":"Transfer task ownership, state, authority, evidence, cancellation, and completion through explicit handoff contracts."}]},
    {"id":"AGE-K07","title":"Durable execution, effects, and recovery","description":"Preserves accountable state and effects across retries, crashes, duplicates, and deployment change.","objectives":[{"id":"AGE-K07-01","statement":"Classify failure and choose retry, resume, reconcile, compensate, escalate, or stop with one final disposition."}]},
    {"id":"AGE-K08","title":"Agent-system evaluation","description":"Evaluates tasks, trajectories, state, actions, effects, controls, recovery, and efficiency.","objectives":[{"id":"AGE-K08-01","statement":"Produce versioned system-specific release evidence with representative tasks, segments, uncertainty, and limitations."}]},
    {"id":"AGE-K09","title":"Security controls and human authority","description":"Implements agent controls while preserving formal specialist and human decision rights.","objectives":[{"id":"AGE-K09-01","statement":"Map threats and faults to independently enforced controls, tests, residual limits, owners, and escalation."}]},
    {"id":"AGE-K10","title":"Observability, performance, and AgentOps","description":"Makes runs diagnosable and supportable within privacy-aware operational envelopes.","objectives":[{"id":"AGE-K10-01","statement":"Trace causal transitions and control quality, time, cost, queue, capacity, and incident response."}]},
    {"id":"AGE-K11","title":"Release, interoperability, and change","description":"Preserves local action semantics through bounded release, protocols, migration, replay, and retirement.","objectives":[{"id":"AGE-K11-01","statement":"Validate protocol and component changes without surrendering identity, effect, authority, or evidence contracts."}]},
    {"id":"AGE-K12","title":"Technical leadership and evidence-earned reuse","description":"Communicates uncertainty and promotes reusable seams only after repeated bounded evidence.","objectives":[{"id":"AGE-K12-01","statement":"Defend claims, preserve authority boundaries, and choose retain, reduce, repair, reuse, platformize, or retire."}]}
  ]
}
